            ================== Day1 ==================

                   Basic SQL I        
                  -------------

Q1:
Ans:

Enter password: ***********
Welcome to the MySQL monitor.  Commands end with ; or \g.
Your MySQL connection id is 13
Server version: 8.0.30 MySQL Community Server - GPL

Copyright (c) 2000, 2022, Oracle and/or its affiliates.

Oracle is a registered trademark of Oracle Corporation and/or its
affiliates. Other names may be trademarks of their respective
owners.

Type 'help;' or '\h' for help. Type '\c' to clear the current input statement.

mysql> create database Sprint4_Assignment1;
Query OK, 1 row affected (0.01 sec)

mysql> show databases;
+---------------------+
| Database            |
+---------------------+
| information_schema  |
| mysql               |
| performance_schema  |
| sb101db             |
| sprint4_assignment1 |
| sys                 |
+---------------------+
6 rows in set (0.01 sec)

mysql> use sprint4_assignment1
Database changed
mysql> show tables;
Empty set (0.01 sec)

mysql> create table DEPOSIT(ACTNO VARCHAR(25), CNAME VARCHAR(20), BNAME VARCHAR(20), AMOUNT INT, ADATE DATE);
Query OK, 0 rows affected (0.05 sec)

mysql> desc DEPOSIT;
+--------+-------------+------+-----+---------+-------+
| Field  | Type        | Null | Key | Default | Extra |
+--------+-------------+------+-----+---------+-------+
| ACTNO  | varchar(25) | YES  |     | NULL    |       |
| CNAME  | varchar(20) | YES  |     | NULL    |       |
| BNAME  | varchar(20) | YES  |     | NULL    |       |
| AMOUNT | int         | YES  |     | NULL    |       |
| ADATE  | date        | YES  |     | NULL    |       |
+--------+-------------+------+-----+---------+-------+
5 rows in set (0.01 sec)

mysql> create table BRANCH(BNAME VARCHAR(20), CITY VARCHAR(20));
Query OK, 0 rows affected (0.02 sec)

mysql> desc BRANCH;
+-------+-------------+------+-----+---------+-------+
| Field | Type        | Null | Key | Default | Extra |
+-------+-------------+------+-----+---------+-------+
| BNAME | varchar(20) | YES  |     | NULL    |       |
| CITY  | varchar(20) | YES  |     | NULL    |       |
+-------+-------------+------+-----+---------+-------+
2 rows in set (0.00 sec)

mysql> create table CUSTOMER(CNAME VARCHAR(20), CITY VARCHAR(20));
Query OK, 0 rows affected (0.02 sec)

mysql> desc CUSTOMER;
+-------+-------------+------+-----+---------+-------+
| Field | Type        | Null | Key | Default | Extra |
+-------+-------------+------+-----+---------+-------+
| CNAME | varchar(20) | YES  |     | NULL    |       |
| CITY  | varchar(20) | YES  |     | NULL    |       |
+-------+-------------+------+-----+---------+-------+
2 rows in set (0.00 sec)

mysql> create table BORROW(LOANNO VARCHAR(5), CNAME VARCHAR(20), BNAME VARCHAR(20), AMOUNT INT);
Query OK, 0 rows affected (0.03 sec)

mysql> desc BORROW;
+--------+-------------+------+-----+---------+-------+
| Field  | Type        | Null | Key | Default | Extra |
+--------+-------------+------+-----+---------+-------+
| LOANNO | varchar(5)  | YES  |     | NULL    |       |
| CNAME  | varchar(20) | YES  |     | NULL    |       |
| BNAME  | varchar(20) | YES  |     | NULL    |       |
| AMOUNT | int         | YES  |     | NULL    |       |
+--------+-------------+------+-----+---------+-------+
4 rows in set (0.00 sec)

mysql>



Q2:
Ans:

mysql> desc DEPOSIT; desc BRANCH; desc CUSTOMER; desc BORROW;
+--------+-------------+------+-----+---------+-------+
| Field  | Type        | Null | Key | Default | Extra |
+--------+-------------+------+-----+---------+-------+
| ACTNO  | varchar(25) | YES  |     | NULL    |       |
| CNAME  | varchar(20) | YES  |     | NULL    |       |
| BNAME  | varchar(20) | YES  |     | NULL    |       |
| AMOUNT | int         | YES  |     | NULL    |       |
| ADATE  | date        | YES  |     | NULL    |       |
+--------+-------------+------+-----+---------+-------+
5 rows in set (0.00 sec)

+-------+-------------+------+-----+---------+-------+
| Field | Type        | Null | Key | Default | Extra |
+-------+-------------+------+-----+---------+-------+
| BNAME | varchar(20) | YES  |     | NULL    |       |
| CITY  | varchar(20) | YES  |     | NULL    |       |
+-------+-------------+------+-----+---------+-------+
2 rows in set (0.00 sec)

+-------+-------------+------+-----+---------+-------+
| Field | Type        | Null | Key | Default | Extra |
+-------+-------------+------+-----+---------+-------+
| CNAME | varchar(20) | YES  |     | NULL    |       |
| CITY  | varchar(20) | YES  |     | NULL    |       |
+-------+-------------+------+-----+---------+-------+
2 rows in set (0.00 sec)

+--------+-------------+------+-----+---------+-------+
| Field  | Type        | Null | Key | Default | Extra |
+--------+-------------+------+-----+---------+-------+
| LOANNO | varchar(5)  | YES  |     | NULL    |       |
| CNAME  | varchar(20) | YES  |     | NULL    |       |
| BNAME  | varchar(20) | YES  |     | NULL    |       |
| AMOUNT | int         | YES  |     | NULL    |       |
+--------+-------------+------+-----+---------+-------+
4 rows in set (0.00 sec)

mysql>


Q3:
Ans:

(i)->

mysql> insert into DEPOSIT values(100, 'ANIL', 'VRCE', 1000.00, '1995-03-01');
Query OK, 1 row affected (0.01 sec)

mysql> insert into DEPOSIT values(101, 'SUNIL', 'MGROAD', 5000.00, '1996-01-04');
Query OK, 1 row affected (0.00 sec)

mysql> insert into DEPOSIT values(102, 'RAHUL', 'KAROLBAGH', 3500.00, '1995-11-17');
Query OK, 1 row affected (0.00 sec)

mysql> insert into DEPOSIT values(103, 'MADHURAI', 'CHANDNI', 1200.00, '1995-12-17');
Query OK, 1 row affected (0.00 sec)

mysql> insert into DEPOSIT values(104, 'PRAMOD', 'MGROAD', 3000.00, '1996-03-27');
Query OK, 1 row affected (0.00 sec)

mysql> insert into DEPOSIT values(105, 'SANDIP', 'KAROLBAGH', 2000.00, '1996-03-31');
Query OK, 1 row affected (0.00 sec)

mysql> select * from DEPOSIT;
+-------+----------+-----------+--------+------------+
| ACTNO | CNAME    | BNAME     | AMOUNT | ADATE      |
+-------+----------+-----------+--------+------------+
| 100   | ANIL     | VRCE      |   1000 | 1995-03-01 |
| 101   | SUNIL    | MGROAD    |   5000 | 1996-01-04 |
| 102   | RAHUL    | KAROLBAGH |   3500 | 1995-11-17 |
| 103   | MADHURAI | CHANDNI   |   1200 | 1995-12-17 |
| 104   | PRAMOD   | MGROAD    |   3000 | 1996-03-27 |
| 105   | SANDIP   | KAROLBAGH |   2000 | 1996-03-31 |
+-------+----------+-----------+--------+------------+
6 rows in set (0.00 sec)


(ii)->

mysql> desc branch;
+-------+-------------+------+-----+---------+-------+
| Field | Type        | Null | Key | Default | Extra |
+-------+-------------+------+-----+---------+-------+
| BNAME | varchar(20) | YES  |     | NULL    |       |
| CITY  | varchar(20) | YES  |     | NULL    |       |
+-------+-------------+------+-----+---------+-------+
2 rows in set (0.00 sec)

mysql> alter table branch change BNAME BRANCH varchar(20);
Query OK, 0 rows affected (0.03 sec)
Records: 0  Duplicates: 0  Warnings: 0

mysql> desc BRANCH;
+--------+-------------+------+-----+---------+-------+
| Field  | Type        | Null | Key | Default | Extra |
+--------+-------------+------+-----+---------+-------+
| BRANCH | varchar(20) | YES  |     | NULL    |       |
| CITY   | varchar(20) | YES  |     | NULL    |       |
+--------+-------------+------+-----+---------+-------+
2 rows in set (0.00 sec)

mysql> insert into branch values('VRCE', 'NAGPUR'),('KAROLBAGH', 'DELHI'), ('CHANDANI', 'DELHI'), ('MGROAD', 'BANGLORE');
Query OK, 4 rows affected (0.00 sec)
Records: 4  Duplicates: 0  Warnings: 0

mysql> select * from branch;
+-----------+----------+
| BRANCH    | CITY     |
+-----------+----------+
| VRCE      | NAGPUR   |
| KAROLBAGH | DELHI    |
| CHANDANI  | DELHI    |
| MGROAD    | BANGLORE |
+-----------+----------+
4 rows in set (0.00 sec)

mysql>

(iii)->

mysql> alter table borrow change AMOUNT AMOUNT float(6,2);
Query OK, 0 rows affected, 1 warning (0.04 sec)
Records: 0  Duplicates: 0  Warnings: 1

mysql> desc borrow;
+--------+-------------+------+-----+---------+-------+
| Field  | Type        | Null | Key | Default | Extra |
+--------+-------------+------+-----+---------+-------+
| LOANNO | varchar(5)  | YES  |     | NULL    |       |
| CNAME  | varchar(20) | YES  |     | NULL    |       |
| BNAME  | varchar(20) | YES  |     | NULL    |       |
| AMOUNT | float(6,2)  | YES  |     | NULL    |       |
+--------+-------------+------+-----+---------+-------+
4 rows in set (0.00 sec)

mysql> insert into borrow values(201, 'ANIL', 'VRCE', 1000.00), (206, 'RAHUL', 'KAROLBAGH', 5000.00), (311, 'SUNIL', 'MGROAD', 3000.00), (321, 'MADHURI', 'CHANDNI', 2000.00), (375, 'PRAMOD', 'MGROAD', 8000.00);
Query OK, 5 rows affected (0.00 sec)
Records: 5  Duplicates: 0  Warnings: 0

mysql> SELECT * FROM BORROW;
+--------+---------+-----------+---------+
| LOANNO | CNAME   | BNAME     | AMOUNT  |
+--------+---------+-----------+---------+
| 201    | ANIL    | VRCE      | 1000.00 |
| 206    | RAHUL   | KAROLBAGH | 5000.00 |
| 311    | SUNIL   | MGROAD    | 3000.00 |
| 321    | MADHURI | CHANDNI   | 2000.00 |
| 375    | PRAMOD  | MGROAD    | 8000.00 |
+--------+---------+-----------+---------+
5 rows in set (0.00 sec)

(iv)->

mysql> desc customer;
+-------+-------------+------+-----+---------+-------+
| Field | Type        | Null | Key | Default | Extra |
+-------+-------------+------+-----+---------+-------+
| CNAME | varchar(20) | YES  |     | NULL    |       |
| CITY  | varchar(20) | YES  |     | NULL    |       |
+-------+-------------+------+-----+---------+-------+
2 rows in set (0.00 sec)

mysql> insert into customer values('ANIL', 'CALCUTA'), ('RAHUL', 'BARODA'), ('MADHURI', 'NAGPUR'), ('PRAMOD', 'NAGPUR'), ('SUNIL', 'DELHI');
Query OK, 5 rows affected (0.01 sec)
Records: 5  Duplicates: 0  Warnings: 0

mysql> select * from customer;
+---------+---------+
| CNAME   | CITY    |
+---------+---------+
| ANIL    | CALCUTA |
| RAHUL   | BARODA  |
| MADHURI | NAGPUR  |
| PRAMOD  | NAGPUR  |
| SUNIL   | DELHI   |
+---------+---------+
5 rows in set (0.00 sec)

mysql>


Q4:
Ans:
mysql> select * from borrow where (AMOUNT >= 2000 && AMOUNT <=3000);
+--------+---------+---------+---------+
| LOANNO | CNAME   | BNAME   | AMOUNT  |
+--------+---------+---------+---------+
| 311    | SUNIL   | MGROAD  | 3000.00 |
| 321    | MADHURI | CHANDNI | 2000.00 |
+--------+---------+---------+---------+
2 rows in set, 1 warning (0.00 sec)


Q5:
Ans:

mysql> select * from deposit;
+-------+----------+-----------+--------+------------+
| ACTNO | CNAME    | BNAME     | AMOUNT | ADATE      |
+-------+----------+-----------+--------+------------+
| 100   | ANIL     | VRCE      |   1000 | 1995-03-01 |
| 101   | SUNIL    | MGROAD    |   5000 | 1996-01-04 |
| 102   | RAHUL    | KAROLBAGH |   3500 | 1995-11-17 |
| 103   | MADHURAI | CHANDNI   |   1200 | 1995-12-17 |
| 104   | PRAMOD   | MGROAD    |   3000 | 1996-03-27 |
| 105   | SANDIP   | KAROLBAGH |   2000 | 1996-03-31 |
+-------+----------+-----------+--------+------------+
6 rows in set (0.00 sec)

Q6:
Ans:

mysql> select ACTNO, CNAME from deposit;
+-------+----------+
| ACTNO | CNAME    |
+-------+----------+
| 100   | ANIL     |
| 101   | SUNIL    |
| 102   | RAHUL    |
| 103   | MADHURAI |
| 104   | PRAMOD   |
| 105   | SANDIP   |
+-------+----------+
6 rows in set (0.00 sec)

Q7:
Ans:
mysql> select * from customer where CITY='NAGPUR';
+---------+--------+
| CNAME   | CITY   |
+---------+--------+
| MADHURI | NAGPUR |
| PRAMOD  | NAGPUR |
+---------+--------+
2 rows in set (0.00 sec)

Q8:
Ans:

mysql> select CNAME from DEPOSIT where (ADATE > '1995-11-17');
+----------+
| CNAME    |
+----------+
| SUNIL    |
| MADHURAI |
| PRAMOD   |
| SANDIP   |
+----------+
4 rows in set (0.00 sec)


Q9:
Ans:

mysql> select ACTNO, AMOUNT from DEPOSIT where (ADATE >= '1995-12-01' && ADATE <= '1996-06-01');
+-------+--------+
| ACTNO | AMOUNT |
+-------+--------+
| 101   |   5000 |
| 103   |   1200 |
| 104   |   3000 |
| 105   |   2000 |
+-------+--------+
4 rows in set, 1 warning (0.00 sec)


Q10:
mysql> select * from DEPOSIT;
+-------+----------+-----------+--------+------------+
| ACTNO | CNAME    | BNAME     | AMOUNT | ADATE      |
+-------+----------+-----------+--------+------------+
| 100   | ANIL     | VRCE      |   1000 | 1995-03-01 |
| 101   | SUNIL    | MGROAD    |   5000 | 1996-01-04 |
| 102   | RAHUL    | KAROLBAGH |   3500 | 1995-11-17 |
| 103   | MADHURAI | CHANDNI   |   1200 | 1995-12-17 |
| 104   | PRAMOD   | MGROAD    |   3000 | 1996-03-27 |
| 105   | SANDIP   | KAROLBAGH |   2000 | 1996-03-31 |
+-------+----------+-----------+--------+------------+
6 rows in set (0.00 sec)

Ans:
mysql> select * from deposit where CNAME LIKE 'C%';
Empty set (0.00 sec)


Q11:
Ans:

mysql> select * from borrow where CNAME LIKE '_U%';
+--------+-------+--------+---------+
| LOANNO | CNAME | BNAME  | AMOUNT  |
+--------+-------+--------+---------+
| 311    | SUNIL | MGROAD | 3000.00 |
+--------+-------+--------+---------+
1 row in set (0.00 sec)

Q12:
Ans:
mysql> select * from deposit where (BNAME = 'CHANDNI' || BNAME= 'MGROAD');
+-------+----------+---------+--------+------------+
| ACTNO | CNAME    | BNAME   | AMOUNT | ADATE      |
+-------+----------+---------+--------+------------+
| 101   | SUNIL    | MGROAD  |   5000 | 1996-01-04 |
| 103   | MADHURAI | CHANDNI |   1200 | 1995-12-17 |
| 104   | PRAMOD   | MGROAD  |   3000 | 1996-03-27 |
+-------+----------+---------+--------+------------+
3 rows in set, 1 warning (0.00 sec)

Q13:
Ans:

mysql> select * from deposit where (BNAME != 'CHANDNI' &&  BNAME!= 'MGROAD');
+-------+--------+-----------+--------+------------+
| ACTNO | CNAME  | BNAME     | AMOUNT | ADATE      |
+-------+--------+-----------+--------+------------+
| 100   | ANIL   | VRCE      |   1000 | 1995-03-01 |
| 102   | RAHUL  | KAROLBAGH |   3500 | 1995-11-17 |
| 105   | SANDIP | KAROLBAGH |   2000 | 1996-03-31 |
+-------+--------+-----------+--------+------------+
3 rows in set, 1 warning (0.00 sec)


Q14:
Ans:

mysql> select * from  deposit where (AMOUNT > 1000)  order by CNAME asc;
+-------+----------+-----------+--------+------------+
| ACTNO | CNAME    | BNAME     | AMOUNT | ADATE      |
+-------+----------+-----------+--------+------------+
| 103   | MADHURAI | CHANDNI   |   1200 | 1995-12-17 |
| 104   | PRAMOD   | MGROAD    |   3000 | 1996-03-27 |
| 102   | RAHUL    | KAROLBAGH |   3500 | 1995-11-17 |
| 105   | SANDIP   | KAROLBAGH |   2000 | 1996-03-31 |
| 101   | SUNIL    | MGROAD    |   5000 | 1996-01-04 |
+-------+----------+-----------+--------+------------+
5 rows in set (0.00 sec)


Q15:
Ans:

mysql> select * from  deposit where (AMOUNT > 1000)  order by CNAME desc;
+-------+----------+-----------+--------+------------+
| ACTNO | CNAME    | BNAME     | AMOUNT | ADATE      |
+-------+----------+-----------+--------+------------+
| 101   | SUNIL    | MGROAD    |   5000 | 1996-01-04 |
| 105   | SANDIP   | KAROLBAGH |   2000 | 1996-03-31 |
| 102   | RAHUL    | KAROLBAGH |   3500 | 1995-11-17 |
| 104   | PRAMOD   | MGROAD    |   3000 | 1996-03-27 |
| 103   | MADHURAI | CHANDNI   |   1200 | 1995-12-17 |
+-------+----------+-----------+--------+------------+
5 rows in set (0.00 sec)


Q16:
Ans:

mysql> select * from borrow where (CNAME LIKE '__A%') || (CNAME LIKE '__D%');
+--------+---------+---------+---------+
| LOANNO | CNAME   | BNAME   | AMOUNT  |
+--------+---------+---------+---------+
| 321    | MADHURI | CHANDNI | 2000.00 |
| 375    | PRAMOD  | MGROAD  | 8000.00 |
+--------+---------+---------+---------+
2 rows in set, 1 warning (0.00 sec)


Q17:
Ans:

mysql> select * from borrow where AMOUNT not between 2000 and 8000;
+--------+-------+-------+---------+
| LOANNO | CNAME | BNAME | AMOUNT  |
+--------+-------+-------+---------+
| 201    | ANIL  | VRCE  | 1000.00 |
+--------+-------+-------+---------+
1 row in set (0.00 sec)


Q18:

mysql> select * from deposit;
+-------+----------+-----------+--------+------------+
| ACTNO | CNAME    | BNAME     | AMOUNT | ADATE      |
+-------+----------+-----------+--------+------------+
| 100   | ANIL     | VRCE      |   1000 | 1995-03-01 |
| 101   | SUNIL    | MGROAD    |   5000 | 1996-01-04 |
| 102   | RAHUL    | KAROLBAGH |   3500 | 1995-11-17 |
| 103   | MADHURAI | CHANDNI   |   1200 | 1995-12-17 |
| 104   | PRAMOD   | MGROAD    |   3000 | 1996-03-27 |
| 105   | SANDIP   | KAROLBAGH |   2000 | 1996-03-31 |
+-------+----------+-----------+--------+------------+
6 rows in set (0.00 sec)

Ans:

mysql>  select distinct * from deposit;
+-------+----------+-----------+--------+------------+
| ACTNO | CNAME    | BNAME     | AMOUNT | ADATE      |
+-------+----------+-----------+--------+------------+
| 100   | ANIL     | VRCE      |   1210 | 1995-03-01 |
| 101   | SUNIL    | MGROAD    |   5500 | 1996-01-04 |
| 102   | RAHUL    | KAROLBAGH |   3850 | 1995-11-17 |
| 103   | MADHURAI | CHANDNI   |   1320 | 1995-12-17 |
| 104   | PRAMOD   | MGROAD    |   3300 | 1996-03-27 |
| 105   | SANDIP   | KAROLBAGH |   2200 | 1996-03-31 |
+-------+----------+-----------+--------+------------+
6 rows in set (0.00 sec)

Q19:
Ans:

mysql> update deposit set AMOUNT = AMOUNT + (AMOUNT* 0.1) where (BNAME = 'VRCE');
Query OK, 1 row affected (0.01 sec)
Rows matched: 1  Changed: 1  Warnings: 0

mysql> select * from deposit;
+-------+----------+-----------+--------+------------+
| ACTNO | CNAME    | BNAME     | AMOUNT | ADATE      |
+-------+----------+-----------+--------+------------+
| 100   | ANIL     | VRCE      |   1464 | 1995-03-01 |
| 101   | SUNIL    | MGROAD    |   6050 | 1996-01-04 |
| 102   | RAHUL    | KAROLBAGH |   4235 | 1995-11-17 |
| 103   | MADHURAI | CHANDNI   |   1452 | 1995-12-17 |
| 104   | PRAMOD   | MGROAD    |   3630 | 1996-03-27 |
| 105   | SANDIP   | KAROLBAGH |   2420 | 1996-03-31 |
+-------+----------+-----------+--------+------------+
6 rows in set (0.00 sec)


Q20:
Ans:

mysql> update deposit set AMOUNT = AMOUNT+ (AMOUNT * 0.1) where (BNAME = 'VRCE' && CNAME = 'ANIL');
Query OK, 1 row affected, 1 warning (0.00 sec)
Rows matched: 1  Changed: 1  Warnings: 1

mysql> select * from deposit;
+-------+----------+-----------+--------+------------+
| ACTNO | CNAME    | BNAME     | AMOUNT | ADATE      |
+-------+----------+-----------+--------+------------+
| 100   | ANIL     | VRCE      |   1210 | 1995-03-01 |
| 101   | SUNIL    | MGROAD    |   5500 | 1996-01-04 |
| 102   | RAHUL    | KAROLBAGH |   3850 | 1995-11-17 |
| 103   | MADHURAI | CHANDNI   |   1320 | 1995-12-17 |
| 104   | PRAMOD   | MGROAD    |   3300 | 1996-03-27 |
| 105   | SANDIP   | KAROLBAGH |   2200 | 1996-03-31 |
+-------+----------+-----------+--------+------------+
6 rows in set (0.00 sec)



                   Basic SQL II        
                  --------------


Student table created:
mysql> select * from student;
+--------+--------+--------+---------+
| NAME   | ROLLNO | BRANCH | CITY    |
+--------+--------+--------+---------+
| VIJAYA |    150 | CSE    | CHENNAI |
| SITA   |    202 | ETC    | KOLKATA |
| RAVI   |    300 | EEE    | DELHI   |
| BASU   |    165 | ETC    | CHENNAI |
| RASMI  |    107 | ETC    | RKL     |
| KARAN  |    111 | CSE    | CTC     |
| REKHA  |    117 | BME    | BBSR    |
+--------+--------+--------+---------+
7 rows in set (0.00 sec)


Q1:
Ans:

mysql> select count(*) from student;
+----------+
| count(*) |
+----------+
|        7 |
+----------+
1 row in set (0.02 sec)


Q2:
Ans:

mysql> select count(*) from student where BRANCH like 'E%';
+----------+
| count(*) |
+----------+
|        4 |
+----------+
1 row in set (0.00 sec)


Q3:
Ans:

mysql> alter table student add MARKS int(8);
Query OK, 0 rows affected, 1 warning (0.02 sec)
Records: 0  Duplicates: 0  Warnings: 1

mysql> select * from student;
+--------+--------+--------+---------+-------+
| NAME   | ROLLNO | BRANCH | CITY    | MARKS |
+--------+--------+--------+---------+-------+
| VIJAYA |    150 | CSE    | CHENNAI |  NULL |
| SITA   |    202 | ETC    | KOLKATA |  NULL |
| RAVI   |    300 | EEE    | DELHI   |  NULL |
| BASU   |    165 | ETC    | CHENNAI |  NULL |
| RASMI  |    107 | ETC    | RKL     |  NULL |
| KARAN  |    111 | CSE    | CTC     |  NULL |
| REKHA  |    117 | BME    | BBSR    |  NULL |
+--------+--------+--------+---------+-------+
7 rows in set (0.00 sec)


Q4:
Ans:

mysql> alter table student change NAME NAME varchar(25);
Query OK, 0 rows affected (0.01 sec)
Records: 0  Duplicates: 0  Warnings: 0

mysql> select * from student;
+--------+--------+--------+---------+-------+
| NAME   | ROLLNO | BRANCH | CITY    | MARKS |
+--------+--------+--------+---------+-------+
| VIJAYA |    150 | CSE    | CHENNAI |  NULL |
| SITA   |    202 | ETC    | KOLKATA |  NULL |
| RAVI   |    300 | EEE    | DELHI   |  NULL |
| BASU   |    165 | ETC    | CHENNAI |  NULL |
| RASMI  |    107 | ETC    | RKL     |  NULL |
| KARAN  |    111 | CSE    | CTC     |  NULL |
| REKHA  |    117 | BME    | BBSR    |  NULL |
+--------+--------+--------+---------+-------+
7 rows in set (0.00 sec)


Q5:
Ans:

mysql> delete from student where BRANCH = 'ETC';
Query OK, 3 rows affected (0.01 sec)

mysql> select * from student;
+--------+--------+--------+---------+-------+
| NAME   | ROLLNO | BRANCH | CITY    | MARKS |
+--------+--------+--------+---------+-------+
| VIJAYA |    150 | CSE    | CHENNAI |  NULL |
| RAVI   |    300 | EEE    | DELHI   |  NULL |
| KARAN  |    111 | CSE    | CTC     |  NULL |
| REKHA  |    117 | BME    | BBSR    |  NULL |
+--------+--------+--------+---------+-------+
4 rows in set (0.00 sec)


Q6:
Ans:

mysql> rename table student to studinformation;
Query OK, 0 rows affected (0.02 sec)

mysql> desc studinformation;
+--------+-------------+------+-----+---------+-------+
| Field  | Type        | Null | Key | Default | Extra |
+--------+-------------+------+-----+---------+-------+
| NAME   | varchar(25) | YES  |     | NULL    |       |
| ROLLNO | int         | YES  |     | NULL    |       |
| BRANCH | varchar(20) | YES  |     | NULL    |       |
| CITY   | varchar(20) | YES  |     | NULL    |       |
| MARKS  | int         | YES  |     | NULL    |       |
+--------+-------------+------+-----+---------+-------+
5 rows in set (0.00 sec)

mysql> select * from studinformation;
+--------+--------+--------+---------+-------+
| NAME   | ROLLNO | BRANCH | CITY    | MARKS |
+--------+--------+--------+---------+-------+
| VIJAYA |    150 | CSE    | CHENNAI |  NULL |
| RAVI   |    300 | EEE    | DELHI   |  NULL |
| KARAN  |    111 | CSE    | CTC     |  NULL |
| REKHA  |    117 | BME    | BBSR    |  NULL |
+--------+--------+--------+---------+-------+
4 rows in set (0.00 sec)


Q7:
Ans:

mysql> delete from studinformation;
Query OK, 4 rows affected (0.00 sec)

mysql> select * from studinformation;
Empty set (0.00 sec)


Q8:
mysql> show tables;
+-------------------------------+
| Tables_in_sprint4_assignment1 |
+-------------------------------+
| borrow                        |
| branch                        |
| customer                      |
| deposit                       |
| studinformation               |
+-------------------------------+
5 rows in set (0.00 sec)

Ans:

mysql> drop table studinformation;
Query OK, 0 rows affected (0.01 sec)

mysql> show tables;
+-------------------------------+
| Tables_in_sprint4_assignment1 |
+-------------------------------+
| borrow                        |
| branch                        |
| customer                      |
| deposit                       |
+-------------------------------+
4 rows in set (0.00 sec)



         -----------*****------------











